[
	{
		"uniqueId": "jsonataA",
		"queryPath": "jsonataA.json",
		"inputType": "JsonString",
		"outputType": "JsonString"
	},
	{
		"uniqueId": "jsonataA2",
		"queryPath": "jsonataA2.json",
		"inputType": "JsonString",
		"outputType": "JsonString"
	},
	{
		"uniqueId": "jsonataB",
		"queryPath": "jsonataB.json",
		"inputType": "JsonString",
		"outputType": "JsonString"
	}
]
