[
 {
  "uniqueId": "jsonataA",
  "queryPath": "jsonataA.jsonata",
  "inputType": "JsonString",
  "outputType": "JsonString"
 },
 {
  "uniqueId": "jsonataB",
  "queryPath": "jsonataB.jsonata",
  "inputType": "JsonString",
  "outputType": "JsonString"
 },
 {
  "uniqueId": "jsonataC",
  "queryPath": "jsonataC.jsonata",
  "inputType": "JsonString",
  "outputType": "JsonString"
 }
]